_id,genres,movie,directors,stars,year,runtime,Up_System,index
2751,"Horror, Sci-Fi",The Demented,Christopher Roosevelt,"Kayla Ewell, Richard Kohnke, Ashlee Brian, Brittney Alger",2013.0,92.0,CM,0
3840,"Animation, Comedy, Science Fiction",The Demented Cartoon Movie! ,Brian Kendall,,2001.0,30.0,CM,0
2579,"Action, Adventure, Sci-Fi",Robotech,Andy Muschietti,,,,CM,1
4788,"Action, Adventure, Science Fiction",Green Lantern Corps ,,,2020.0,,CM,1
3009,"Action, Drama, Sci-Fi",Cyborg 2087,Franklin Adreon,"Michael Rennie, Karen Steele, Wendell Corey, Warren Stevens",1966.0,86.0,CM,2
1327,"Drama, Science Fiction",Cyborg 2087 ,Franklin Adreon,"Michael Rennie, Karen Steele, Wendell Corey, Warren Stevens, Harry Carey, Jr.",1966.0,86.0,CM,2
914,"Adventure, Sci-Fi",Stasis,Nicole Jones-Dion,"Anna Harr, Mark Grossman, London Grace, Tiana Masaniai",2017.0,90.0,CM,3
2646,"Adventure, Science Fiction",Stasis ,Nicole Jones-Dion,"Anna Harr, Mark Grossman, Phyllis Spielman, Tiana Masaniai, Caleb Thomas",2017.0,84.0,CM,3
4955,"Drama, Romance, Sci-Fi",The Cosmonaut,Nicols Alcal,"Katrine De Candole, Leon Ockenden, Max Wrottesley, Hans-Eckart Eckhardt",2013.0,93.0,CM,4
3703,"Drama, Science Fiction",The Cosmonaut ,Nicols Alcal,"Katrine De Candole, Max Wrottesley, Leon Ockenden, Hans-Eckart Eckhardt, David Barrass",2013.0,102.0,CM,4
2210,"Horror, Sci-Fi",Not of This Earth,Roger Corman,"Paul Birch, Beverly Garland, Morgan Jones, William Roerick",1957.0,67.0,CM,5
3850,"Horror, Science Fiction",Not of This Earth ,Roger Corman,"Paul Birch, Beverly Garland, Morgan Jones, William Roerick, Jonathan Haze",1957.0,67.0,CM,5
3944,"Animation, Action, Adventure",Hullabaloo,James Lopez,"Yuri Lowenthal, Mary Robinette Kowal, G.D. Falksen",,,CM,6
1274,"Action, Science Fiction",Silver Surfer: Prodigal Son ,,,2019.0,,CM,6
4788,"Action, Adventure, Science Fiction",Green Lantern Corps ,,,2020.0,,CM,7
3263,"Action, Horror, Sci-Fi",Texas Zombie Wars: El Paso Outpost,A.K. Waters,"Mikal Vega, Melissa Mars, Max Mullen, Anna Terry",,,CM,7
47,"Thriller, Science Fiction",95ers: Time Runners ,Thomas Gomez Durham,"Alesandra Durham, Joel Bishop, Terence Goodman, Ian Paul Freeth, Chris Laird",2013.0,96.0,CM,8
4666,"Sci-Fi, Thriller",95ers: Echoes,Thomas Gomez Durham,"Alesandra Durham, Joel Bishop, Terence Goodman, K. Danor Gerald",2013.0,96.0,CM,8
2218,"Animation, Comedy, Science Fiction, Family",Ultra Nyan 2: The Great Happy Operation ,,"Mei Oshitani, Yoshiko Kamei, Akio Otsuka, Rokuro Naya, Naoki Band",1998.0,30.0,CM,9
1781,Sci-Fi,The Sinister Six,,,,,CM,9
1118,"Action, Science Fiction, Thriller, Horror",The Meg ,Jon Turteltaub,"Jason Statham, Li Bingbing, Rainn Wilson, Cliff Curtis, Ruby Rose",2018.0,113.0,CM,10
24,"Action, Horror, Sci-Fi",The Meg,Jon Turteltaub,"Jason Statham, Bingbing Li, Rainn Wilson, Cliff Curtis",2018.0,113.0,CM,10
4798,"Action, Sci-Fi",Murdercycle,Thomas L. Callaway,"Charles Wesley, Cassandra Ellis, Robert Donavan, Michael Vachetti",1999.0,90.0,CM,11
3,"Action, Science Fiction",Murdercycle ,Thomas L. Callaway,"Charles Wesley, Cassandra Ellis, Robert Donavan, Michael Vachetti, Robert Staccardo",1999.0,90.0,CM,11
2653,"Comedy, Sci-Fi",Thermae Romae,Hideki Takeuchi,"Hiroshi Abe, Aya Ueto, Kazuki Kitamura, Riki Takeuchi",2012.0,108.0,CM,12
466,"Drama, Comedy, Science Fiction",Thermae Romae ,Hideki Takeuchi,"Hiroshi Abe, Aya Ueto, Masachika Ichimura, Kazuki Kitamura, Kai Shishido",2012.0,108.0,CM,12
938,"Adventure, Comedy, Mystery",Cocoon: The Return,Daniel Petrie,"Don Ameche, Wilford Brimley, Courteney Cox, Hume Cronyn",1988.0,116.0,CM,13
2799,"Comedy, Drama, Science Fiction",Cocoon: The Return ,Daniel Petrie,"Don Ameche, Wilford Brimley, Courteney Cox, Hume Cronyn, Jack Gilford",1988.0,116.0,CM,13
4997,"Drama, Horror, Science Fiction",Stake Land ,Jim Mickle,"Danielle Harris, Kelly McGillis, Nick Damici, Connor Paolo, Gregory Jones",2010.0,98.0,CM,14
1078,"Drama, Horror, Sci-Fi",Stake Land,Jim Mickle,"Connor Paolo, Nick Damici, Kelly McGillis, Gregory Jones",2010.0,98.0,CM,14
2365,"Fantasy, Action, Science Fiction",Hellboy ,Guillermo del Toro,"Ron Perlman, John Hurt, Selma Blair, Rupert Evans, Jeffrey Tambor",2004.0,122.0,CM,15
44,"Action, Fantasy, Horror",Hellboy,Guillermo del Toro,"Ron Perlman, Doug Jones, Selma Blair, John Hurt",2004.0,122.0,CM,15
4390,"Horror, Sci-Fi, Thriller",The Forbidden Dimensions,Christopher James Miller,"Al Ridenour, Carl Crew, Brittany O'Neil, Amy Daly",2013.0,86.0,CM,16
1528,"Horror, Science Fiction, Thriller",The Forbidden Dimensions ,Christopher James Miller,"Brittany O'Neil, Kyle Morris, Al Ridenour, Carl Crew, Christopher James Miller",2013.0,86.0,CM,16
2537,"Action, Science Fiction",The Archiver ,,,2011.0,4.0,CM,17
1944,"Action, Comedy, Sci-Fi",The Ark: An Iron Sky Story,Timo Vuorensola,"Andy Garcia, Udo Kier, Stephanie Paul, Malla Malmivaara",,,CM,17
4842,"Mystery, Sci-Fi",First on the Moon,Aleksey Fedorchenko,"Boris Vlasov, Viktoriya Ilyinskaya, Anatoliy Otradnov, Aleksei Slavnin",2005.0,75.0,CM,18
1034,"Mystery, Science Fiction",First on the Moon ,Aleksey Fedorchenko,"Aleksey Anisimov, Viktoriya Ilyinskaya, Viktor Kotov",2005.0,75.0,CM,18
3889,Sci-Fi,The Last Boy,James Haven,,,,CM,19
1424,"Action, Adventure, Fantasy, Science Fiction",X-Men: The Legend of Wolverine ,,"Cedric Smith, Cathal J. Dodd, George Buza, Norm Spencer, Lenore Zann",2003.0,79.0,CM,19
4799,"Adventure, Science Fiction",Circuitry Man II: Plughead Rewired ,"Robert Lovy, Steven Lovy","Vernon Wells, Deborah Shelton, Jim Metzler, Dennis Christopher, Nicholas Worth",1994.0,98.0,CM,20
4384,Sci-Fi,Plughead Rewired: Circuitry Man II,"Robert Lovy, Steven Lovy","Vernon Wells, Deborah Shelton, Jim Metzler, Dennis Christopher",1994.0,98.0,CM,20
3058,"Drama, Science Fiction",Thread ,Alexander Voulgaris,"Sofia Kokkali, Vangelis Loukissas, Daphne Patakia, Giorgos Karpathakis, Sofia Georgovassili",2017.0,94.0,CM,21
4217,"Drama, Sci-Fi",Thread,Alexander Voulgaris,"Sofia Kokkali, Vangelis Loukissas, Daphne Patakia, Giorgos Karpathakis",2016.0,94.0,CM,21
4019,"Action, Horror, Sci-Fi",The Dead Undead,"Matthew R. Anderson, Edward Conna","Luke Goss, Matthew R. Anderson, Spice Williams-Crosby, Luke LaFontaine",2010.0,90.0,CM,22
4541,"Horror, Science Fiction, Action",The Dead Undead ,"Edward Conna, Matthew R. Anderson","Luke Goss, Joshua Alba, Matthew R. Anderson, Laura Chinn, Cameron Goodman",2010.0,90.0,CM,22
4952,"Science Fiction, Horror",Z/Rex: The Jurassic Dead ,"Milko Davis, Thomas Martwick","Matt Block, Ben Johnson, Raquel Pennington, Cooper Elliott, Adam Singer",2017.0,82.0,CM,23
3080,"Action, Adventure, Comedy",The Jurassic Dead,"Milko Davis Main Director, Thomas Martwick","Matt Block, Cooper Elliott, Ben Johnson, Mia Paris",2017.0,82.0,CM,23
3585,"Science Fiction, Thriller",O2 ,,Anne Hathaway,2019.0,,CM,24
2499,"Sci-Fi, Thriller",Firestarter,Fatih Akin,,,,CM,24
2550,"Action, Comedy, Adventure",The Wild World of Batwoman,Jerry Warren,"Katherine Victor, George Mitchell, Steve Brodie, Richard Banks",1966.0,70.0,CM,25
2008,"Adventure, Crime, Comedy, Science Fiction",The Wild World of Batwoman ,Jerry Warren,"Katherine Victor, George Mitchell, Steve Brodie, Richard Banks, Steve Conte",1966.0,70.0,CM,25
4262,Sci-Fi,2177: The San Francisco Love Hacker Crimes,Jose Figueroa,"Sean Patrick Flanery, Dominique Swain, Miracle Laurie, Shane Coffey",,98.0,CM,26
2537,"Action, Science Fiction",The Archiver ,,,2011.0,4.0,CM,26
65,"Drama, Science Fiction",LFO ,Antonio Tubln,"Patrik Karlson, Izabella Jo Tschig, Per Lfberg, Ahnna Rasch, Lukas Loughran",2013.0,94.0,CM,27
3945,"Drama, Sci-Fi",LFO,Antonio Tublen,"Patrik Karlson, Izabella Jo Tschig, Per Lfberg, Ahnna Rasch",2013.0,94.0,CM,27
874,"Science Fiction, Family, Animation",Chronopolis ,Piotr Kamler,Michael Lonsdale,1982.0,52.0,CM,28
4688,"Animation, Drama, Fantasy",Chronopolis,Piotr Kamler,Michael Lonsdale,1982.0,52.0,CM,28
4166,"Action, Science Fiction",The Last Warrior ,Romolo Guerrieri,"William Mang, Marina Costa, Harrison Muller Jr., Woody Strode, Margit Evelyn Newton",1984.0,95.0,CM,29
4085,"Action, Sci-Fi",The Final Executioner,Romolo Guerrieri,"William Mang, Marina Costa, Harrison Muller, Woody Strode",1984.0,95.0,CM,29
1416,"Horror, Mystery, Science Fiction, Thriller",Invasion of the Body Snatchers ,Philip Kaufman,"Donald Sutherland, Brooke Adams, Leonard Nimoy, Veronica Cartwright, Jeff Goldblum",1978.0,116.0,CM,30
509,"Horror, Sci-Fi",Invasion of the Body Snatchers,Philip Kaufman,"Donald Sutherland, Brooke Adams, Jeff Goldblum, Veronica Cartwright",1978.0,115.0,CM,30
1413,"Horror, Science Fiction",Mutant Species ,David A. Prior,"Leo Rossi, Ted Prior, Denise Crosby, Grant Gelt, Powers Boothe",1995.0,100.0,CM,31
3351,"Horror, Sci-Fi",Mutant Species,David A. Prior,"Leo Rossi, Ted Prior, Denise Crosby, Grant Gelt",1994.0,100.0,CM,31
3884,"Action, Adventure, Animation, Science Fiction",Scryed Alteration II: Tao ,Goro Taniguchi,,2011.0,96.0,CM,32
4649,Sci-Fi,Gene Warz II: Walkabout,,"Vitina Marcus, Lena Pousette, J.J. Diambrini-Palazzi, Nigel Barber",,,CM,32
3163,"Action, Sci-Fi",626 Evolution,John Lyde,"Brandon Ray Olive, Demetrius Daniels, Michael Flynn, James Gaisford",2017.0,79.0,CM,33
2165,"Action, Science Fiction",626 Evolution ,John Lyde,"Danielle C. Ryan, James Gaisford, Michael Flynn, Demetrius Daniels, Landon Henneman",2017.0,79.0,CM,33
4703,"Action, Science Fiction",Princess Blade ,Shinsuke Sato,"Yumiko Shaku, Shir Sano, Yichi Numata, Kyusaku Shimada, Yko Chsokabe",2001.0,95.0,CM,34
3698,"Action, Sci-Fi",The Princess Blade,Shinsuke Sato,"Yumiko Shaku, Hideaki It, Yichi Numata, Shir Sano",2001.0,93.0,CM,34
1356,"Comedy, Horror, Sci-Fi",Hobgoblins,Rick Sloane,"Tom Bartlett, Paige Sullivan, Steven Boggs, Kelley Palmer",1988.0,88.0,CM,35
1087,"Horror, Action, Comedy, Thriller, Science Fiction",Hobgoblins ,Rick Sloane,"Tom Bartlett, Paige Sullivan, Steven Boggs, Kelley Palmer, Billy Frank",1988.0,92.0,CM,35
980,"Drama, Family, Sci-Fi",After Darkness,Batan Silva,"Natalia Dyer, Valorie Curry, Kyra Sedgwick, Tim Daly",2018.0,98.0,CM,36
2596,"Drama, Family, Thriller, Science Fiction",After Darkness ,Batan Silva,"Natalia Dyer, Valorie Curry, Kyra Sedgwick, Tim Daly, John Patrick Amedori",2019.0,98.0,CM,36
2304,"Drama, Sci-Fi",Journey to the Far Side of the Sun,Robert Parrish,"Roy Thinnes, Ian Hendry, Patrick Wymark, Lynn Loring",1969.0,101.0,CM,37
2106,Science Fiction,Journey to the Far Side of the Sun ,Robert Parrish,"Roy Thinnes, Ian Hendry, Patrick Wymark, Lynn Loring, Loni von Friedl",1969.0,101.0,CM,37
3534,Sci-Fi,The Day the Sky Exploded,"Paolo Heusch, Mario Bava","Paul Hubschmid, Madeleine Fischer, Fiorella Mari, Ivo Garrani",1958.0,82.0,CM,38
4148,"Science Fiction, Action",The Day the Sky Exploded ,"Mario Bava, Paolo Heusch","Paul Hubschmid, Fiorella Mari, Madeleine Fischer, Ivo Garrani, Dario Michaelis",1958.0,82.0,CM,38
3772,"Science Fiction, Action, Adventure, Thriller",Star Trek V: The Final Frontier ,William Shatner,"William Shatner, Leonard Nimoy, DeForest Kelley, Laurence Luckinbill, Nichelle Nichols",1989.0,107.0,CM,39
585,"Action, Adventure, Fantasy",Star Trek V: The Final Frontier,William Shatner,"William Shatner, Leonard Nimoy, DeForest Kelley, James Doohan",1989.0,107.0,CM,39
4788,"Action, Adventure, Science Fiction",Green Lantern Corps ,,,2020.0,,CM,40
369,"Action, Adventure, Sci-Fi",Live Die Repeat and Repeat,Doug Liman,"Emily Blunt, Tom Cruise",,,CM,40
2944,Sci-Fi,The Tangle,Christopher Soren Kelly,"Joshua Bitton, Christopher Soren Kelly, Jessica Graham, Nicole da Silva",,,CM,41
2537,"Action, Science Fiction",The Archiver ,,,2011.0,4.0,CM,41
2180,Science Fiction,Nobility ,E.J. De la Pena,"Cas Anvar, Walter Koenig, Doug Jones, Darren Jacobs, Torri Higginson",2017.0,120.0,CM,42
2128,Sci-Fi,Nobility,E.J. De la Pena,"Cas Anvar, Torri Higginson, Doug Jones, Darren Jacobs",2017.0,50.0,CM,42
2077,"Comedy, Drama, Sci-Fi",No Men Beyond This Point,Mark Sawers,"Patrick Gilmore, Bronwen Smith, Tara Pratt, Kristine Cofsky",2015.0,80.0,CM,43
2015,"Drama, Comedy, Science Fiction",No Men Beyond This Point ,Mark Sawers,"Rekha Sharma, Alissa Skovbye, Matthew Harrison, Patrick Gilmore, Benita Ha",2015.0,80.0,CM,43
2372,"Animation, Science Fiction",Mobile Suit Gundam F91 ,Yoshiyuki Tomino,"Masaki Maeda, Yumi Touma, Chie Koujiro, Kiyoyuki Yanada, Mari Yokoo",1991.0,115.0,CM,44
3445,"Animation, Action, Sci-Fi",Mobile Suit Gundam F91,Yoshiyuki Tomino,"Kji Tsujitani, Yumi Tma, Masaaki Maeda, Kiyoyuki Yanada",1991.0,120.0,CM,44
3706,"Action, Adventure, Science Fiction, Family, Fantasy",Mighty Morphin Power Rangers: The Movie ,Bryan Spicer,"Amy Jo Johnson, Jason David Frank, David Yost, Johnny Yong Bosch, Steve Cardenas",1995.0,92.0,CM,45
720,"Action, Adventure, Family",Mighty Morphin Power Rangers: The Movie,Bryan Spicer,"Karan Ashley, Johnny Yong Bosch, Steve Cardenas, Jason David Frank",1995.0,95.0,CM,45
1148,Sci-Fi,Genesis,"Freddie Hutton-Mills, Bart Ruspoli","Olivia Grant, Chik Okonkwo, John Hannah, Warren Brown",2018.0,114.0,CM,46
2098,"Horror, Science Fiction, Drama",Genesis ,Peter Rose,,1991.0,4.0,CM,46
3865,"Drama, Sci-Fi",Into the Void,Matt Weinglass,"Davin Anderson, Jeff Glassberg, Ryan Foland, Alexandra Ford",2000.0,90.0,CM,47
4000,"Science Fiction, Drama",Into the Void ,Matt Weinglass,"Autumn Reeser, Davin Anderson, Jeff Glassberg, Ryan Foland, Alexandra Ford",2000.0,90.0,CM,47
1559,"Drama, Sci-Fi",Missile to the Moon,Richard E. Cunha,"Richard Travis, Cathy Downs, K.T. Stevens, Tommy Cook",1958.0,78.0,CM,48
2614,Science Fiction,Missile to the Moon ,Richard E. Cunha,"Richard Travis, Cathy Downs, K. T. Stevens, Tommy Cook, Nina Bara",1958.0,78.0,CM,48
535,"Adventure, Comedy, Family, Fantasy, Science Fiction",Aliens in the Attic ,John Schultz,"Carter Jenkins, Austin Butler, Kevin Nealon, Robert Hoffman, Doris Roberts",2009.0,86.0,CM,49
1292,"Animation, Adventure, Comedy",Aliens in the Attic,John Schultz,"Ashley Tisdale, Robert Hoffman, Carter Jenkins, Austin Butler",2009.0,86.0,CM,49
103,"Horror, Romance, Science Fiction",Spring ,"Justin Benson, Aaron Moorhead","Lou Taylor Pucci, Nadia Hilker, Nick Nevern, Augie Duke, Jeremy Gardner",2014.0,109.0,CM,50
444,"Horror, Romance, Sci-Fi",Spring,"Justin Benson, Aaron Moorhead","Lou Taylor Pucci, Nadia Hilker, Francesco Carnelutti, Nick Nevern",2014.0,109.0,CM,50
2933,"Drama, Science Fiction",Perfect: Android Rising ,Chris R. Notarile,"Roberto Lombardi, Samantha Talbott, Kasey Williams, Rick Zahn, Hector De La Rosa",2013.0,85.0,CM,51
4771,"Action, Drama, Sci-Fi",Perfect: Android Rising,Chris R. Notarile,"Roberto Lombardi, Samantha Talbott, Kasey Williams, Rick Zahn",2013.0,80.0,CM,51
1829,"Action, Horror, Mystery, Science Fiction",Gunhed ,"Alan Smithee, Masato Harada","Masahiro Takashima, Brenda Bakke, James Brewster Thompson, Aya Enjoji, Kaori Mizushima",1989.0,92.0,CM,52
2703,"Action, Sci-Fi, Thriller",Gunhed,Masato Harada,"Masahiro Takashima, Brenda Bakke, James Brewster Thompson, Aya Enjji",1989.0,100.0,CM,52
3597,"Mystery, Sci-Fi, Thriller",Moebius,Gustavo Mosquera R.,"Guillermo Angelelli, Roberto Carnaghi, Annabella Levy, Jorge Petraglia",1996.0,88.0,CM,53
1163,Science Fiction,Moebius ,Gustavo Mosquera R.,"Guillermo Angelelli, Roberto Carnaghi, Annabella Levy, Jorge Petraglia, Miguel ngel Paludi",1996.0,88.0,CM,53
3393,"Adventure, Comedy, Romance, Science Fiction, War",Invisible Agent ,Edwin L. Marin,"Ilona Massey, Jon Hall, Peter Lorre, Cedric Hardwicke, J. Edward Bromberg",1942.0,81.0,CM,54
3093,"Adventure, Comedy, Romance",Invisible Agent,Edwin L. Marin,"Ilona Massey, Jon Hall, Peter Lorre, Cedric Hardwicke",1942.0,81.0,CM,54
199,"Action, Sci-Fi",Batman & Robin,Joel Schumacher,"Arnold Schwarzenegger, George Clooney, Chris O'Donnell, Uma Thurman",1997.0,125.0,CM,55
721,"Science Fiction, Action, Fantasy, Comedy",Batman & Robin ,Joel Schumacher,"George Clooney, Chris O'Donnell, Arnold Schwarzenegger, Uma Thurman, Alicia Silverstone",1997.0,125.0,CM,55
400,"Action, Adventure, Horror",Deep Rising,Stephen Sommers,"Treat Williams, Famke Janssen, Anthony Heald, Kevin J. O'Connor",1998.0,106.0,CM,56
2305,"Adventure, Action, Horror, Science Fiction",Deep Rising ,Stephen Sommers,"Treat Williams, Famke Janssen, Anthony Heald, Kevin J. O'Connor, Una Damon",1998.0,106.0,CM,56
3582,"Horror, Sci-Fi",The Drift,Darren Scales,"Jonny Black, Victoria Hopkins, Vin Hawke, Peter Revel-Walsh",2014.0,101.0,CM,57
2001,Science Fiction,The Drift ,Darren Scales,"Jonny Black, Victoria Hopkins, Vin Hawke, Peter Revel-Walsh, David Dobson",2014.0,100.0,CM,57
581,"Action, Comedy, Sci-Fi",Wild Wild West,Barry Sonnenfeld,"Will Smith, Kevin Kline, Kenneth Branagh, Salma Hayek",1999.0,106.0,CM,58
3226,"Action, Adventure, Comedy, Science Fiction, Western",Wild Wild West ,Barry Sonnenfeld,"Will Smith, Kevin Kline, Kenneth Branagh, Salma Hayek, M. Emmet Walsh",1999.0,106.0,CM,58
3233,"Horror, Sci-Fi",I Was a Teenage Frankenstein,Herbert L. Strock,"Whit Bissell, Phyllis Coates, Robert Burton, Gary Conway",1957.0,74.0,CM,59
2495,"Horror, Science Fiction",I Was a Teenage Frankenstein ,Herbert L. Strock,"Whit Bissell, Phyllis Coates, Robert Burton, Gary Conway, George Lynn",1957.0,74.0,CM,59
2035,"Animation, Action, Sci-Fi",Ghost in the Shell: The New Movie,"Kazuchika Kise, Kazuya Nomura","Maaya Sakamoto, Ken'ichir Matsuda, Ikkyu Juku, Kazuya Nakai",2015.0,100.0,CM,60
1570,"Science Fiction, Animation",Ghost in the Shell: The New Movie ,"Nomura Kazuya, Kazuchika Kise","Maaya Sakamoto, Ken'ichir Matsuda, Kazuya Nakai, Ikkyuu Juku, Kenji Nojima",2015.0,100.0,CM,60
3159,"Action, Science Fiction, Thriller, Adventure, Horror, Fantasy",Beowulf ,Graham Baker,"Christopher Lambert, Rhona Mitra, Oliver Cotton, Gtz Otto, Vincent Hammond",1999.0,95.0,CM,61
702,"Action, Adventure, Fantasy",Beowulf,Graham Baker,"Christopher Lambert, Rhona Mitra, Oliver Cotton, Gtz Otto",1999.0,95.0,CM,61
4183,"Action, Sci-Fi",Choke Canyon,Charles Bail,"Stephen Collins, Janet Julian, Bo Svenson, Lance Henriksen",1986.0,94.0,CM,62
3231,"Action, Science Fiction",Choke Canyon ,Charles Bail,"Stephen Collins, Bo Svenson, Janet Julian, Lance Henriksen, Nicholas Pryor",1986.0,94.0,CM,62
4434,"Mystery, Sci-Fi, Thriller",Assumption of Risk,Mark Kochanowicz,"Brian Anthony Wilson, Dan McGlaughlin, Frankie Faison, Patricia Mizen",2014.0,97.0,CM,63
193,"Thriller, Mystery, Science Fiction",Assumption of Risk ,Mark Kochanowicz,,2014.0,97.0,CM,63
1460,"Drama, Science Fiction, Animation",Neon Genesis Evangelion: The End of Evangelion ,"Hideaki Anno, Kazuya Tsurumaki","Megumi Ogata, Megumi Hayashibara, Kotono Mitsuishi, Yuko Miyamura, Fumihiko Tachiki",1997.0,87.0,CM,64
544,"Animation, Action, Drama",Neon Genesis Evangelion: The End of Evangelion,"Hideaki Anno, Kazuya Tsurumaki","Megumi Ogata, Megumi Hayashibara, Yko Miyamura, Kotono Mitsuishi",1997.0,90.0,CM,64
4171,"Horror, Science Fiction, Action",Underworld ,George Pavlou,"Denholm Elliott, Steven Berkoff, Nicola Cowper, Larry Lamb, Irina Brook",1985.0,103.0,CM,65
1836,"Action, Horror, Sci-Fi",Underworld,George Pavlou,"Denholm Elliott, Steven Berkoff, Larry Lamb, Nicola Cowper",1985.0,103.0,CM,65
4828,"Sci-Fi, Thriller",Menno's Mind,Jon Kroll,"Billy Campbell, Stephanie Romanov, Corbin Bernsen, Michael Dorn",1997.0,95.0,CM,66
1402,"Thriller, Science Fiction",Menno's Mind ,Jon Kroll,"Billy Campbell, Corbin Bernsen, Michael Dorn, Robert Picardo, Stephanie Romanov",1997.0,95.0,CM,66
3497,"Science Fiction, Comedy",Dickshark ,Bill Zebub,"Erin Brown, Kayla Browne, Rachel Crow, Greg Fuller, John Giancaspro",2016.0,149.0,CM,67
1864,"Comedy, Sci-Fi",Dickshark,Bill Zebub,"Kayla Browne, John Giancaspro, Rachel Crow, Greg Fuller",2016.0,200.0,CM,67
2531,"Science Fiction, Horror",They Came from Beyond Space ,Freddie Francis,"Robert Hutton, Jennifer Jayne, Bernard Kay, Zia Mohyeddin, Geoffrey Wallace",1967.0,85.0,CM,68
2775,"Adventure, Sci-Fi",They Came from Beyond Space,Freddie Francis,"Robert Hutton, Jennifer Jayne, Zia Mohyeddin, Bernard Kay",1967.0,85.0,CM,68
1553,"Horror, Sci-Fi, Thriller",The Curse of Frankenstein,Terence Fisher,"Peter Cushing, Hazel Court, Robert Urquhart, Christopher Lee",1957.0,82.0,CM,69
4801,"Horror, Science Fiction",The Curse of Frankenstein ,Terence Fisher,"Peter Cushing, Hazel Court, Robert Urquhart, Christopher Lee, Melvyn Hayes",1957.0,82.0,CM,69
3019,"Action, Comedy, Sci-Fi",Roller Blade,Donald G. Jackson,"Suzanne Solari, Jeff Hutchinson, Shaun Michelle, Katina Garner",1986.0,88.0,CM,70
3390,"Action, Science Fiction",Roller Blade ,Donald G. Jackson,"Suzanne Solari, Jeff Hutchinson, Shaun Michelle, Katina Garner, Sam Mann",1986.0,88.0,CM,70
4183,"Science Fiction, Adventure, Action",The Golden Bat ,Hajime Sato,"Sonny Chiba, Wataru Yamagawa, Hisako Tsukuba, Emily Takami, Osamu Kobayashi",1966.0,73.0,CM,71
4846,"Adventure, Action, Sci-Fi",The Golden Bat,Hajime Sat,"Shin'ichi Chiba, Osamu Kobayashi, Wataru Yamagawa, Hisako Tsukuba",1966.0,73.0,CM,71
4655,"Documentary, Biography, Mystery",Love and Saucers,Brad Abrahams,David Huggins,2017.0,67.0,CM,72
2157,"Documentary, Mystery, Romance, Science Fiction",Love & Saucers ,Brad Abrahams,David Huggins,2017.0,67.0,CM,72
4788,"Action, Adventure, Science Fiction",Green Lantern Corps ,,,2020.0,,CM,73
3980,"Action, Horror, Sci-Fi",The Epidemic,Nigel Hartwell,"Eric Roberts, Chris Owen, Kurt Angle, Larry Zerner",,95.0,CM,73
1758,Science Fiction,Hover ,Matt Osterman,"Cleopatra Coleman, Shane Coffey, Craig muMs Grant, Fabianne Therese, Rhoda Griffis",2018.0,86.0,CM,74
1661,Sci-Fi,Hover,Matt Osterman,"Cleopatra Coleman, Shane Coffey, Craig muMs Grant, Fabianne Therese",2018.0,86.0,CM,74
2537,"Action, Science Fiction",The Archiver ,,,2011.0,4.0,CM,75
1868,"Romance, Sci-Fi",Behind the Curtain of Night,Dalibor Stach,"Brendan Fraser, Dawn Olivieri, Marcia Cross, Petra Buckova",,,CM,75
2050,Science Fiction,Assignment: Outer Space ,Antonio Margheriti,"Rik Van Nutter, Gabriella Farinon, David Montresor, Archie Savage, Alain Dijon",1960.0,73.0,CM,76
3227,Sci-Fi,Assignment: Outer Space,Antonio Margheriti,"Rik Van Nutter, Gabriella Farinon, David Montresor, Archie Savage",1960.0,73.0,CM,76
1789,"Action, Sci-Fi",Kill Order,James Mark,"Chris Mark, Jessica Clement, Denis Akiyama, Daniel Park",2017.0,77.0,CM,77
4975,"Science Fiction, Action",Kill Order ,James Mark,"Chris Mark, Denis Akiyama, Jonny Caines, Scott Cavalheiro, Alain Moussi",2017.0,,CM,77
4340,"Action, Science Fiction",Droid Gunner ,Fred Olen Ray,"Marc Singer, Matthias Hues, Rochelle Swanson, Robin Clarke, Kin Shriner",1995.0,90.0,CM,78
2577,"Action, Sci-Fi",Droid Gunner,Fred Olen Ray,"Marc Singer, Matthias Hues, Rochelle Swanson, Robin Clarke",1995.0,90.0,CM,78
4805,Sci-Fi,13 Days to Midnight,,,,,CM,79
715,"Animation, Comedy, Science Fiction, Family, TV Movie",From the Diaries of Ijon Tichy: A Voyage to Interopia ,Gennady Tishchenko,,1985.0,10.0,CM,79
2186,"Action, Animation, Family, Science Fiction",Spiderman: The Ultimate Villain Showdown ,,"Christopher Daniel Barnes, Sara Ballantine, Efrem Zimbalist Jr., Neil Ross, Billy 'Pop' Atmore",2002.0,79.0,CM,80
3259,"Action, Crime, Sci-Fi",Knight Rider,,,,,CM,80
2211,"Horror, Sci-Fi",The Creeping Flesh,Freddie Francis,"Christopher Lee, Peter Cushing, Lorna Heilbron, George Benson",1973.0,92.0,CM,81
4904,"Horror, Science Fiction",The Creeping Flesh ,Freddie Francis,"Christopher Lee, Peter Cushing, Lorna Heilbron, George Benson, Kenneth J. Warren",1973.0,94.0,CM,81
4542,"Horror, Science Fiction",The Leech Woman ,Edward Dein,"Coleen Gray, Grant Williams, Phillip Terry, Gloria Talbott, John van Dreelen",1960.0,77.0,CM,82
3090,"Horror, Romance, Sci-Fi",The Leech Woman,Edward Dein,"Coleen Gray, Grant Williams, Phillip Terry, Gloria Talbott",1960.0,77.0,CM,82
4979,"Action, Sci-Fi",Project Shadowchaser II,John Eyres,"Frank Zagarino, Bryan Genesse, Beth Toussaint, Daniel Bonjour",1994.0,94.0,CM,83
534,"Science Fiction, Action",Project Shadowchaser II ,John Eyres,"Frank Zagarino, Bryan Genesse, Beth Toussaint, Daniel Bonjour, Jeff Fannell",1994.0,94.0,CM,83
4855,"Science Fiction, Drama, Romance",Paradox ,"Fran Ervin, Stevo Chang","Thomas Blankenship, Thomas Blankenship, Holly Rone",2015.0,88.0,CM,84
3503,"Drama, Romance, Sci-Fi",Paradox,"Steven Chang, Stevo Chang, Fran Ervin","Thomas Blankenship, Stevo Chang, Fran Ervin, Richard Ervin",2016.0,103.0,CM,84
4106,"Action, Adventure, Sci-Fi",Real Playing Game,"Tino Navarro, David Rebordo","Cian Barry, Alix Wilton Regan, Nik Xhelilaj, Pedro Granger",2013.0,103.0,CM,85
2397,"Science Fiction, Action, Adventure",Real Playing Game ,David Rebordo,"Cian Barry, Alix Wilton Regan, Nik Xhelilaj, Pedro Granger, Christopher Goh",2013.0,103.0,CM,85
4889,"Action, Animation, Adventure, Crime, Science Fiction",Batman: Return of the Caped Crusaders ,Rick Morales,"Adam West, Burt Ward, Julie Newmar, Jeff Bergman, Sirena Irwin",2016.0,78.0,CM,86
1272,"Animation, Action, Adventure",Batman: Return of the Caped Crusaders,Rick Morales,"Adam West, Burt Ward, Julie Newmar, Jeff Bergman",2016.0,78.0,CM,86
4160,"Sci-Fi, Horror",The Projected Man,"Ian Curteis, John Croydon","Mary Peach, Bryant Haliday, Norman Wooland, Ronald Allen",1966.0,77.0,CM,87
4372,"Horror, Science Fiction",The Projected Man ,Ian Curteis,"Mary Peach, Bryant Haliday, Norman Wooland, Ronald Allen, Derek Farr",1966.0,77.0,CM,87
3291,"Action, Adventure, Comedy, Family, Fantasy, Science Fiction",Teenage Mutant Ninja Turtles III ,Stuart Gillard,"Paige Turco, Stuart Wilson, Sab Shimono, Vivian Wu, Mark Caso",1993.0,96.0,CM,88
739,"Action, Adventure, Comedy",Teenage Mutant Ninja Turtles III,Stuart Gillard,"Elias Koteas, Paige Turco, Stuart Wilson, Sab Shimono",1993.0,96.0,CM,88
4883,"Action, Sci-Fi, Thriller",Black Hole,Brad Peyton,,,,CM,89
1234,"Thriller, Science Fiction, Action",Black Hole ,Brad Peyton,,2019.0,,CM,89
3858,"Action, Sci-Fi, Thriller",Convict 762,Luca Bercovici,"Shannon Sturges, Michole Briana White, Charlie Spradling, Shae D'lyn",1997.0,97.0,CM,90
